{
  "$schema": "https://json-schema.org/draft/2020-12/schema",
  "title": "DestinyPixel complete hexagram learning article v2",
  "type": "object",
  "properties": {
    "subtitle": {
      "type": "string",
      "minLength": 1
    },
    "schemaVersion": {
      "const": 2
    },
    "id": {
      "type": "string",
      "pattern": "^hexagram-(0[1-9]|[1-5][0-9]|6[0-4])$"
    },
    "locale": {
      "enum": [
        "en",
        "zh",
        "zh-TW",
        "ru"
      ]
    },
    "kingWenNumber": {
      "type": "integer",
      "minimum": 1,
      "maximum": 64
    },
    "name": {
      "type": "string",
      "minLength": 1
    },
    "displayName": {
      "type": "string",
      "minLength": 1
    },
    "pinyin": {
      "type": "string",
      "minLength": 1
    },
    "englishName": {
      "type": "string",
      "minLength": 1
    },
    "unicode": {
      "type": "string",
      "minLength": 1
    },
    "codePoint": {
      "type": "string",
      "pattern": "^U\\+4D[C-F][0-9A-F]$"
    },
    "upperTrigram": {
      "type": "object",
      "properties": {
        "id": {
          "enum": [
            "qian",
            "kun",
            "zhen",
            "kan",
            "gen",
            "xun",
            "li",
            "dui"
          ]
        },
        "name": {
          "type": "string",
          "minLength": 1
        },
        "image": {
          "type": "string",
          "minLength": 1
        },
        "symbol": {
          "type": "string",
          "minLength": 1
        },
        "linesBottomUp": {
          "type": "array",
          "items": {
            "enum": [
              0,
              1
            ]
          },
          "minItems": 3,
          "maxItems": 3
        }
      },
      "required": [
        "id",
        "name",
        "image",
        "symbol",
        "linesBottomUp"
      ],
      "additionalProperties": false
    },
    "lowerTrigram": {
      "type": "object",
      "properties": {
        "id": {
          "enum": [
            "qian",
            "kun",
            "zhen",
            "kan",
            "gen",
            "xun",
            "li",
            "dui"
          ]
        },
        "name": {
          "type": "string",
          "minLength": 1
        },
        "image": {
          "type": "string",
          "minLength": 1
        },
        "symbol": {
          "type": "string",
          "minLength": 1
        },
        "linesBottomUp": {
          "type": "array",
          "items": {
            "enum": [
              0,
              1
            ]
          },
          "minItems": 3,
          "maxItems": 3
        }
      },
      "required": [
        "id",
        "name",
        "image",
        "symbol",
        "linesBottomUp"
      ],
      "additionalProperties": false
    },
    "linesBottomUp": {
      "type": "array",
      "items": {
        "enum": [
          0,
          1
        ]
      },
      "minItems": 6,
      "maxItems": 6
    },
    "title": {
      "type": "string",
      "minLength": 1
    },
    "plainSummary": {
      "type": "string",
      "minLength": 1
    },
    "learningQuestion": {
      "type": [
        "string",
        "null"
      ]
    },
    "introduction": {
      "type": "array",
      "items": {
        "type": "string",
        "minLength": 1
      },
      "minItems": 1
    },
    "identityText": {
      "type": "string",
      "minLength": 1
    },
    "guaci": {
      "type": "object",
      "properties": {
        "label": {
          "type": "string",
          "minLength": 1
        },
        "classical": {
          "type": "string",
          "minLength": 1
        },
        "classicalTranslation": {
          "type": [
            "string",
            "null"
          ]
        },
        "paragraphs": {
          "type": "array",
          "items": {
            "type": "string",
            "minLength": 1
          },
          "minItems": 1
        },
        "sourceRefs": {
          "type": "array",
          "items": {
            "type": "string",
            "minLength": 1
          },
          "minItems": 1,
          "uniqueItems": true
        }
      },
      "required": [
        "label",
        "classical",
        "classicalTranslation",
        "paragraphs",
        "sourceRefs"
      ],
      "additionalProperties": false
    },
    "tenWings": {
      "type": "object",
      "properties": {
        "label": {
          "type": "string",
          "minLength": 1
        },
        "paragraphs": {
          "type": "array",
          "items": {
            "type": "string",
            "minLength": 1
          },
          "minItems": 1
        },
        "sourceRefs": {
          "type": "array",
          "items": {
            "type": "string",
            "minLength": 1
          },
          "minItems": 1,
          "uniqueItems": true
        }
      },
      "required": [
        "label",
        "paragraphs",
        "sourceRefs"
      ],
      "additionalProperties": false
    },
    "lineNotes": {
      "type": "array",
      "items": {
        "type": "object",
        "properties": {
          "position": {
            "type": "integer",
            "minimum": 1,
            "maximum": 6
          },
          "label": {
            "type": "string",
            "minLength": 1
          },
          "polarity": {
            "enum": [
              "yin",
              "yang"
            ]
          },
          "classical": {
            "type": "string",
            "minLength": 1
          },
          "classicalTranslation": {
            "type": [
              "string",
              "null"
            ]
          },
          "focus": {
            "type": "string",
            "minLength": 1
          },
          "paragraphs": {
            "type": "array",
            "items": {
              "type": "string",
              "minLength": 1
            },
            "minItems": 2
          },
          "sourceRefs": {
            "type": "array",
            "items": {
              "type": "string",
              "minLength": 1
            },
            "minItems": 1,
            "uniqueItems": true
          }
        },
        "required": [
          "position",
          "label",
          "polarity",
          "classical",
          "classicalTranslation",
          "focus",
          "paragraphs",
          "sourceRefs"
        ],
        "additionalProperties": false
      },
      "minItems": 6,
      "maxItems": 6
    },
    "specialStatement": {
      "anyOf": [
        {
          "type": "object",
          "properties": {
            "label": {
              "type": "string",
              "minLength": 1
            },
            "classical": {
              "type": "string",
              "minLength": 1
            },
            "classicalTranslation": {
              "type": [
                "string",
                "null"
              ]
            },
            "paragraphs": {
              "type": "array",
              "items": {
                "type": "string",
                "minLength": 1
              },
              "minItems": 1
            },
            "sourceRefs": {
              "type": "array",
              "items": {
                "type": "string",
                "minLength": 1
              },
              "minItems": 1,
              "uniqueItems": true
            }
          },
          "required": [
            "label",
            "classical",
            "classicalTranslation",
            "paragraphs",
            "sourceRefs"
          ],
          "additionalProperties": false
        },
        {
          "type": "null"
        }
      ]
    },
    "modernExample": {
      "type": "object",
      "properties": {
        "title": {
          "type": "string",
          "minLength": 1
        },
        "label": {
          "type": "string",
          "minLength": 1
        },
        "paragraphs": {
          "type": "array",
          "items": {
            "type": "string",
            "minLength": 1
          },
          "minItems": 3
        }
      },
      "required": [
        "title",
        "label",
        "paragraphs"
      ],
      "additionalProperties": false
    },
    "misreadings": {
      "type": "array",
      "items": {
        "type": "string",
        "minLength": 1
      },
      "minItems": 1
    },
    "practice": {
      "type": "array",
      "items": {
        "type": "string",
        "minLength": 1
      },
      "minItems": 3
    },
    "related": {
      "type": "array",
      "minItems": 1,
      "items": {
        "type": "object",
        "properties": {
          "id": {
            "type": "string",
            "minLength": 1
          },
          "name": {
            "type": "string",
            "minLength": 1
          },
          "paragraph": {
            "type": "string",
            "minLength": 1
          }
        },
        "required": [
          "id",
          "name",
          "paragraph"
        ],
        "additionalProperties": false
      }
    },
    "closing": {
      "type": "string",
      "minLength": 1
    },
    "sourceIds": {
      "type": "array",
      "items": {
        "type": "string",
        "minLength": 1
      },
      "minItems": 1,
      "uniqueItems": true
    },
    "textualNote": {
      "type": [
        "string",
        "null"
      ]
    },
    "createdAt": {
      "type": "string",
      "minLength": 1
    },
    "reviewStatus": {
      "type": "object",
      "properties": {
        "content": {
          "type": "string",
          "minLength": 1
        },
        "lineStructure": {
          "type": "string",
          "minLength": 1
        },
        "citations": {
          "type": "string",
          "minLength": 1
        },
        "editorialReview": {
          "type": "string",
          "minLength": 1
        },
        "nativeExpertReview": {
          "type": "string",
          "minLength": 1
        },
        "published": {
          "type": "boolean"
        }
      },
      "required": [
        "content",
        "lineStructure",
        "citations",
        "editorialReview",
        "nativeExpertReview",
        "published"
      ],
      "additionalProperties": false
    },
    "counts": {
      "type": "object",
      "properties": {
        "chineseCharacterCount": {
          "type": "integer",
          "minimum": 0
        },
        "nonWhitespaceCharacterCount": {
          "type": "integer",
          "minimum": 1
        },
        "countBasis": {
          "type": "string",
          "minLength": 1
        }
      },
      "required": [
        "chineseCharacterCount",
        "nonWhitespaceCharacterCount",
        "countBasis"
      ],
      "additionalProperties": false
    },
    "articleMarkdown": {
      "type": "string",
      "minLength": 1
    },
    "sourceLocale": {
      "const": "zh"
    },
    "sourceContentHash": {
      "type": "string",
      "pattern": "^[0-9a-f]{64}$"
    },
    "translationStatus": {
      "enum": [
        "source_original",
        "complete_translation_pending_review",
        "complete_translation_reviewed"
      ]
    }
  },
  "required": [
    "schemaVersion",
    "id",
    "locale",
    "kingWenNumber",
    "name",
    "displayName",
    "pinyin",
    "englishName",
    "unicode",
    "codePoint",
    "upperTrigram",
    "lowerTrigram",
    "linesBottomUp",
    "title",
    "plainSummary",
    "learningQuestion",
    "introduction",
    "identityText",
    "guaci",
    "tenWings",
    "lineNotes",
    "specialStatement",
    "modernExample",
    "misreadings",
    "practice",
    "related",
    "closing",
    "sourceIds",
    "textualNote",
    "createdAt",
    "reviewStatus",
    "counts",
    "sourceLocale",
    "sourceContentHash",
    "translationStatus",
    "articleMarkdown"
  ],
  "additionalProperties": false
}
