{
  "schemaVersion": 2,
  "id": "hexagram-62",
  "locale": "zh",
  "kingWenNumber": 62,
  "name": "小过",
  "pinyin": "Xiǎo Guò",
  "englishName": "Xiǎo Guò — Small Preponderance",
  "unicode": "䷽",
  "codePoint": "U+4DFD",
  "lowerTrigram": {
    "id": "gen",
    "name": "艮",
    "image": "山",
    "symbol": "☶",
    "linesBottomUp": [
      0,
      0,
      1
    ]
  },
  "upperTrigram": {
    "id": "zhen",
    "name": "震",
    "image": "雷",
    "symbol": "☳",
    "linesBottomUp": [
      1,
      0,
      0
    ]
  },
  "linesBottomUp": [
    0,
    0,
    1,
    1,
    0,
    0
  ],
  "title": "小过卦学习：把小事做细，也避免越过合适的范围",
  "plainSummary": "条件只适合小步时，就把眼前细节照顾好，不必靠更大的动作证明自己。",
  "introduction": [
    "小过不是“小小犯错所以没关系”。卦辞直接区分小事与大事，并以飞鸟留下声音、宜下不宜上取象。六爻不断讨论过、遇、防和戒，使人看见范围、分寸与适时调整的重要。"
  ],
  "identityText": "小过是传统文王序第62卦，卦符䷽，下卦艮☶、上卦震☳，传统取象分别为山与雷。爻从最下方数起，依次为初六、六二、九三、九四、六五、上六。实线为阳，断线为阴；九、六是爻题中标识阳、阴的数字，并不是额外的爻数。",
  "guaci": {
    "label": "卦辞",
    "classical": "小過：亨。利貞。可小事，不可大事。飛鳥遺之音，不宜上宜下，大吉。",
    "paragraphs": [
      "Legge 将小过解释为在小处有所超过，尤其关注礼仪和非根本事项中可以适度调整的分寸。他并不把它解释成可以随意突破原则。",
      "现代学习可以先核实当前具备多少信息、时间和支持。适合完成一个小范围任务时，就认真完成它；不宜因目标看起来不够宏大而贸然扩大。宜下是古典飞鸟图像中的方向，不是个人居住楼层或出行路线的建议。"
    ],
    "sourceRefs": [
      "zhouyi-62",
      "legge1882-62"
    ],
    "classicalTranslation": null
  },
  "tenWings": {
    "label": "十翼中的解释",
    "paragraphs": [
      "《彖传》《象传》属于《易传》，是通常所说的“十翼”中的篇章。下面把传文与卦辞、爻辞分开，再说明现代学习应用。",
      "《彖传》以小者过、与时行解释卦义；《象传》说山上有雷，并列行过乎恭、丧过乎哀、用过乎俭。传文把稍过之处放在恭敬、哀悼与节用等具体情境。",
      "今天可从认真照顾细节理解，但不要求过度自抑、勉强悲伤或剥夺基本需要。什么算合宜的多一点，仍要看实际对象、文化背景与当事人的感受。"
    ],
    "sourceRefs": [
      "zhouyi-62",
      "hon-sep"
    ]
  },
  "lineNotes": [
    {
      "position": 1,
      "label": "初六",
      "polarity": "yin",
      "classical": "飛鳥以凶。",
      "focus": "刚开始就向高处冲，可能缺少落脚点",
      "paragraphs": [
        "飞鸟的图像在初爻便出现，Legge 将之解释为过度上升而导致不利。爻辞没有指向某种现实飞行事故。",
        "在经验不足的任务中，可以先完成一段可验证的工作，再决定是否扩大。过早承诺全部成果，可能使自己连基本条件都来不及确认。"
      ],
      "sourceRefs": [
        "zhouyi-62",
        "legge1882-62"
      ],
      "classicalTranslation": null
    },
    {
      "position": 2,
      "label": "六二",
      "polarity": "yin",
      "classical": "過其祖，遇其妣；不及其君，遇其臣；无咎。",
      "focus": "找到合适的接洽位置，比越级声势更重要",
      "paragraphs": [
        "祖妣、君臣构成古代关系次序。Legge 将其解释为在相应位置上遇到合适对象，避免以敌对或越位方式接近统治者。",
        "现代类比是把问题交给能实际处理的人，尊重清楚的职责分工。但这不意味着任何层级都不可质疑，也不能禁止必要的申诉或寻求帮助。"
      ],
      "sourceRefs": [
        "zhouyi-62",
        "legge1882-62"
      ],
      "classicalTranslation": null
    },
    {
      "position": 3,
      "label": "九三",
      "polarity": "yang",
      "classical": "弗過防之，從或戕之，凶。",
      "focus": "该多做一点检查时，不要只凭侥幸",
      "paragraphs": [
        "这一爻谈未充分防备而受到伤害，Legge 强调额外谨慎的必要。古代警告不能用来责怪现实中遭受伤害的人。",
        "普通事务中，可以在容易遗漏的地方多核对一次，例如确认版本和交接对象。谨慎应对应具体风险，而不是把所有人都当成潜在加害者。"
      ],
      "sourceRefs": [
        "zhouyi-62",
        "legge1882-62"
      ],
      "classicalTranslation": null
    },
    {
      "position": 4,
      "label": "九四",
      "polarity": "yang",
      "classical": "无咎，弗過遇之。往厲必戒，勿用永貞。",
      "focus": "谨慎也要随处境调整",
      "paragraphs": [
        "爻辞同时说无咎、前往有危和勿用永贞，Legge 提醒不必把一种坚定方式永久坚持下去。",
        "一项临时限制如果原有原因已经消失，就可以重新评估。好的分寸并非永远缩手，而是知道眼下为什么收住、什么条件下可以再向前。"
      ],
      "sourceRefs": [
        "zhouyi-62",
        "legge1882-62"
      ],
      "classicalTranslation": null
    },
    {
      "position": 5,
      "label": "六五",
      "polarity": "yin",
      "classical": "密雲不雨，自我西郊，公弋取彼在穴。",
      "focus": "声势已成，实际供给仍可能未到",
      "paragraphs": [
        "密云无雨与弋取穴中之物并列。Legge 对云与历史政治背景作出推测，本文不把该推测当作已经证实的成书事实。",
        "现代可问：准备看似充分，真正需要的帮助是否已经到位？不妨先处理能够实际接触的小范围问题，而不是只等待一个笼统的大机会。"
      ],
      "sourceRefs": [
        "zhouyi-62",
        "legge1882-62"
      ],
      "classicalTranslation": null
    },
    {
      "position": 6,
      "label": "上六",
      "polarity": "yin",
      "classical": "弗遇過之，飛鳥離之，凶，是謂災眚。",
      "focus": "越过适当范围，会错失原本的着陆点",
      "paragraphs": [
        "末爻再次写飞鸟，Legge 读为未能适应处境而飞得过高。它把小处可以稍过与失去分寸区分开来。",
        "如果任务不断膨胀，可以回到最初目的，确认哪些新增部分确实必要。承认需要缩减范围，不等于否定已经完成的努力。"
      ],
      "sourceRefs": [
        "zhouyi-62",
        "legge1882-62"
      ],
      "classicalTranslation": null
    }
  ],
  "specialStatement": null,
  "modernExample": {
    "title": "用有限时间修订一份活动说明",
    "label": "原创现代情境",
    "paragraphs": [
      "一位志愿者只有一个下午整理活动说明。她先确认时间、地点、报名办法和可用联系方式，而不是立刻重做全部视觉设计、历史介绍与宣传语言。",
      "在发布前，她请另一人实际按说明操作，发现一处容易误解的入口，于是及时修正。对暂时无法完成的延伸内容，她列入后续，而没有为了完整外观填入未经核实的信息。",
      "小过的学习由此落在范围与细致：把现有任务做可靠，也承认当前资源的限度。小步不是降低责任，而是让承诺与条件相称。"
    ]
  },
  "misreadings": [
    "小过不预测事故、伤害或天气，防之也不能用于臆测他人的恶意。",
    "恭、哀、俭不应被机械地推成自我贬低、强迫悲伤或损害基本生活的要求。"
  ],
  "practice": [
    "明确一件事眼下能够可靠完成的最小范围。",
    "选择一个有实际理由的细节多检查一次，说明它能避免什么具体问题。",
    "列出一个需要停止扩大范围的信号，同时保留以后重新评估的条件。"
  ],
  "related": [
    {
      "id": "hexagram-28",
      "name": "大过",
      "paragraph": "大过突出承载过重与重大超常处境，小过突出小范围内的分寸和谨慎。大小不是人的价值高低，而是需要按情境辨认的行动尺度。"
    }
  ],
  "closing": "读小过卦时，可以问：此刻多做一件大事，真的比把眼前这一件小事做可靠更有帮助吗？",
  "sourceIds": [
    "zhouyi-62",
    "legge1882-62",
    "hon-sep",
    "unicode-hexagrams",
    "legge-scan-rights"
  ],
  "createdAt": "2026-10-07",
  "reviewStatus": {
    "content": "complete_editorial_draft",
    "lineStructure": "validated",
    "editorialReview": "passed_independent_model_editorial_review",
    "nativeExpertReview": "not_performed",
    "published": false,
    "citations": "source_checked_with_access_limitations_recorded"
  },
  "counts": {
    "chineseCharacterCount": 1627,
    "nonWhitespaceCharacterCount": 1860,
    "countBasis": "reader-facing article prose and quotations, excluding source list, metadata, line diagram and Markdown syntax"
  },
  "learningQuestion": null,
  "textualNote": null,
  "displayName": "小过",
  "sourceLocale": "zh",
  "sourceContentHash": "2a41576261e65e404b473cb64b351c2f09f51ade9d0aa14fff3e7111cf29d0f3",
  "translationStatus": "source_original",
  "articleMarkdown": "# 小过卦学习：把小事做细，也避免越过合适的范围\n\n一句话：条件只适合小步时，就把眼前细节照顾好，不必靠更大的动作证明自己。\n\n小过不是“小小犯错所以没关系”。卦辞直接区分小事与大事，并以飞鸟留下声音、宜下不宜上取象。六爻不断讨论过、遇、防和戒，使人看见范围、分寸与适时调整的重要。\n\n## 先认清这是什么卦\n\n小过是传统文王序第62卦，卦符䷽，下卦艮☶、上卦震☳，传统取象分别为山与雷。爻从最下方数起，依次为初六、六二、九三、九四、六五、上六。实线为阳，断线为阴；九、六是爻题中标识阳、阴的数字，并不是额外的爻数。\n\n卦符：䷽　上卦：震☳　下卦：艮☶\n\n六爻位置自下而上编号；下面的图按实际位置从上往下显示：\n\n```text\n━━━━ ━━━━  上六\n━━━━ ━━━━  六五\n━━━━━━━━━  九四\n━━━━━━━━━  九三\n━━━━ ━━━━  六二\n━━━━ ━━━━  初六\n```\n\n## 卦辞说了什么\n\n经文：“小過：亨。利貞。可小事，不可大事。飛鳥遺之音，不宜上宜下，大吉。”\n\nLegge 将小过解释为在小处有所超过，尤其关注礼仪和非根本事项中可以适度调整的分寸。他并不把它解释成可以随意突破原则。\n\n现代学习可以先核实当前具备多少信息、时间和支持。适合完成一个小范围任务时，就认真完成它；不宜因目标看起来不够宏大而贸然扩大。宜下是古典飞鸟图像中的方向，不是个人居住楼层或出行路线的建议。\n\n## 《易传》怎样解读这个卦\n\n《彖传》《象传》属于《易传》，是通常所说的“十翼”中的篇章。下面把传文与卦辞、爻辞分开，再说明现代学习应用。\n\n《彖传》以小者过、与时行解释卦义；《象传》说山上有雷，并列行过乎恭、丧过乎哀、用过乎俭。传文把稍过之处放在恭敬、哀悼与节用等具体情境。\n\n今天可从认真照顾细节理解，但不要求过度自抑、勉强悲伤或剥夺基本需要。什么算合宜的多一点，仍要看实际对象、文化背景与当事人的感受。\n\n## 六爻逐条读\n\n以下引文属于爻辞；后面的解释为原创学习说明。吉、无咎、有悔等是古代占辞的语言，不能直接换成对个人未来的保证。\n\n### 初六：刚开始就向高处冲，可能缺少落脚点\n\n经文：“飛鳥以凶。”\n\n飞鸟的图像在初爻便出现，Legge 将之解释为过度上升而导致不利。爻辞没有指向某种现实飞行事故。\n\n在经验不足的任务中，可以先完成一段可验证的工作，再决定是否扩大。过早承诺全部成果，可能使自己连基本条件都来不及确认。\n\n### 六二：找到合适的接洽位置，比越级声势更重要\n\n经文：“過其祖，遇其妣；不及其君，遇其臣；无咎。”\n\n祖妣、君臣构成古代关系次序。Legge 将其解释为在相应位置上遇到合适对象，避免以敌对或越位方式接近统治者。\n\n现代类比是把问题交给能实际处理的人，尊重清楚的职责分工。但这不意味着任何层级都不可质疑，也不能禁止必要的申诉或寻求帮助。\n\n### 九三：该多做一点检查时，不要只凭侥幸\n\n经文：“弗過防之，從或戕之，凶。”\n\n这一爻谈未充分防备而受到伤害，Legge 强调额外谨慎的必要。古代警告不能用来责怪现实中遭受伤害的人。\n\n普通事务中，可以在容易遗漏的地方多核对一次，例如确认版本和交接对象。谨慎应对应具体风险，而不是把所有人都当成潜在加害者。\n\n### 九四：谨慎也要随处境调整\n\n经文：“无咎，弗過遇之。往厲必戒，勿用永貞。”\n\n爻辞同时说无咎、前往有危和勿用永贞，Legge 提醒不必把一种坚定方式永久坚持下去。\n\n一项临时限制如果原有原因已经消失，就可以重新评估。好的分寸并非永远缩手，而是知道眼下为什么收住、什么条件下可以再向前。\n\n### 六五：声势已成，实际供给仍可能未到\n\n经文：“密雲不雨，自我西郊，公弋取彼在穴。”\n\n密云无雨与弋取穴中之物并列。Legge 对云与历史政治背景作出推测，本文不把该推测当作已经证实的成书事实。\n\n现代可问：准备看似充分，真正需要的帮助是否已经到位？不妨先处理能够实际接触的小范围问题，而不是只等待一个笼统的大机会。\n\n### 上六：越过适当范围，会错失原本的着陆点\n\n经文：“弗遇過之，飛鳥離之，凶，是謂災眚。”\n\n末爻再次写飞鸟，Legge 读为未能适应处境而飞得过高。它把小处可以稍过与失去分寸区分开来。\n\n如果任务不断膨胀，可以回到最初目的，确认哪些新增部分确实必要。承认需要缩减范围，不等于否定已经完成的努力。\n\n## 用有限时间修订一份活动说明\n\n以下是为学习而设的现代情境。\n\n一位志愿者只有一个下午整理活动说明。她先确认时间、地点、报名办法和可用联系方式，而不是立刻重做全部视觉设计、历史介绍与宣传语言。\n\n在发布前，她请另一人实际按说明操作，发现一处容易误解的入口，于是及时修正。对暂时无法完成的延伸内容，她列入后续，而没有为了完整外观填入未经核实的信息。\n\n小过的学习由此落在范围与细致：把现有任务做可靠，也承认当前资源的限度。小步不是降低责任，而是让承诺与条件相称。\n\n## 几个容易误读的地方\n\n小过不预测事故、伤害或天气，防之也不能用于臆测他人的恶意。\n\n恭、哀、俭不应被机械地推成自我贬低、强迫悲伤或损害基本生活的要求。\n\n## 做一个小练习\n\n1. 明确一件事眼下能够可靠完成的最小范围。\n2. 选择一个有实际理由的细节多检查一次，说明它能避免什么具体问题。\n3. 列出一个需要停止扩大范围的信号，同时保留以后重新评估的条件。\n\n## 和大过卦一起读\n\n大过突出承载过重与重大超常处境，小过突出小范围内的分寸和谨慎。大小不是人的价值高低，而是需要按情境辨认的行动尺度。\n\n读小过卦时，可以问：此刻多做一件大事，真的比把眼前这一件小事做可靠更有帮助吗？\n\n## 阅读依据\n\n- [周易·小過](https://zh.wikisource.org/w/index.php?title=周易/小過&oldid=10643238)。Received text; Wikisource revision 10643238。\n- [The Yî King](https://tianmu.org/good-work-library/confucian/general-texts/the-i-ching-james-legge)。James Legge；Hexagram 62, chapter LXII, judgement, six lines and notes。\n- [Chinese Philosophy of Change (Yijing)](https://plato.stanford.edu/entries/chinese-change/)。Tze-Ki Hon；Modern scholarly context。\n- [Yijing Hexagram Symbols](https://www.unicode.org/charts/PDF/U4DC0.pdf)。Unicode Consortium；U+4DC0–U+4DFF。\n- [Sacred Books of the East volume16 scan metadata](https://commons.wikimedia.org/wiki/File:Sacred_Books_of_the_East_-_Volume_16.djvu)。Edition and rights metadata。\n\n经文引文保留繁体字并加现代标点；正文为简体中文原创学习解读。英文历史底本与中文传世文本对照使用，近现代译者的意见在文中注明。本文不构成医学、投资或其他专业决定的依据。\n"
}
