{
  "schemaVersion": 2,
  "id": "hexagram-13",
  "locale": "zh",
  "kingWenNumber": 13,
  "name": "同人",
  "pinyin": "Tóng Rén",
  "englishName": "Tóng Rén — Fellowship",
  "unicode": "䷌",
  "codePoint": "U+4DCC",
  "lowerTrigram": {
    "id": "li",
    "name": "离",
    "image": "火",
    "symbol": "☲",
    "linesBottomUp": [
      1,
      0,
      1
    ]
  },
  "upperTrigram": {
    "id": "qian",
    "name": "乾",
    "image": "天",
    "symbol": "☰",
    "linesBottomUp": [
      1,
      1,
      1
    ]
  },
  "linesBottomUp": [
    1,
    0,
    1,
    1,
    1,
    1
  ],
  "title": "同人卦学习：共同目标怎样走出小圈子",
  "plainSummary": "想和别人一起做成一件事，先把共同目标说清，也给不同背景的人留下参与的位置。",
  "introduction": [
    "几个人都说赞成一个想法，并不一定已经成为合作者。同人卦从门、宗族、郊野等不同范围写到联结，也写到防备与争夺。它让人思考：所谓我们，究竟包括谁，又因为什么在一起？文章中的现代应用讨论公开合作，古文的战争场景仍按历史意象说明。"
  ],
  "identityText": "同人是传统文王序第13卦，卦符䷌，下卦离☲、上卦乾☰，传统取象分别为火与天。爻从最下方数起，依次为初九、六二、九三、九四、九五、上九。实线为阳，断线为阴；九、六是爻题中标识阳、阴的数字，并不是额外的爻数。",
  "guaci": {
    "label": "卦辞",
    "classical": "同人于野，亨。利涉大川，利君子貞。",
    "paragraphs": [
      "Legge 把同人读作人与人的联合，强调“于野”的较开阔范围，并认为这种联结应超出私人偏好。利涉大川保留共同面对大困难的意象，利贞则给联结加上合宜的条件。",
      "初学时可以先问：我们共享的究竟是一个具体目标，还是彼此熟悉的感觉？共同目标不能抹去差异，也不因人多就自动正确。需要让参与者知道这件事为什么值得投入。"
    ],
    "sourceRefs": [
      "zhouyi-13",
      "legge1882-13"
    ],
    "classicalTranslation": null
  },
  "tenWings": {
    "label": "十翼中的解释",
    "paragraphs": [
      "《彖传》《象传》属于《易传》，是通常所说的“十翼”中的篇章。下面把传文与卦辞、爻辞分开，再说明现代学习应用。",
      "《彖传》谈通天下之志；《象传》以天与火取象，又说“类族辨物”。这让共同性与分辨并列出现，同人并非要求所有事物毫无区别。",
      "现代合作可以既说明一致目标，也辨认不同的能力、观点与责任。若把不同意见都当作不团结，反而难以发现真正的问题。"
    ],
    "sourceRefs": [
      "zhouyi-13",
      "hon-sep"
    ]
  },
  "lineNotes": [
    {
      "position": 1,
      "label": "初九",
      "polarity": "yang",
      "classical": "同人于門，無咎。",
      "focus": "先跨出自己的门",
      "paragraphs": [
        "门口是接触外界的起点。Legge 将其读为联合开始发生，还没有被狭窄私心混入。",
        "发起共同活动时，先用别人能听懂的语言说明想做什么。不要假定新参加的人已经知道你和老朋友之间的默契。"
      ],
      "sourceRefs": [
        "zhouyi-13",
        "legge1882-13"
      ],
      "classicalTranslation": null
    },
    {
      "position": 2,
      "label": "六二",
      "polarity": "yin",
      "classical": "同人于宗，吝。",
      "focus": "熟悉的关系也可能缩小视野",
      "paragraphs": [
        "宗把联结放进宗族范围。Legge 借此讨论联合偏于亲近之人的局限，并未把亲情本身说成错误。",
        "如果重要决定只在几个熟人私聊中完成，可以检查其余参与者是否有机会了解和回应。亲近可以存在，但不能替代公共事务的说明。"
      ],
      "sourceRefs": [
        "zhouyi-13",
        "legge1882-13"
      ],
      "classicalTranslation": null
    },
    {
      "position": 3,
      "label": "九三",
      "polarity": "yang",
      "classical": "伏戎于莽，升其高陵，三歲不興。",
      "focus": "防备与竞争可能阻住相遇",
      "paragraphs": [
        "伏兵草莽、登高窥望而久不行动，是明显的军事画面。Legge 在爻间争取联合的关系中解释这种相持。",
        "普通合作里，可以检查是否把精力都用在猜测别人，而不愿直接澄清需要。三岁不是现实冲突的倒计时，这段也不提供隐蔽对抗的做法。"
      ],
      "sourceRefs": [
        "zhouyi-13",
        "legge1882-13"
      ],
      "classicalTranslation": null
    },
    {
      "position": 4,
      "label": "九四",
      "polarity": "yang",
      "classical": "乘其墉，弗克攻，吉。",
      "focus": "停止对抗可以改变方向",
      "paragraphs": [
        "爬上城墙，却没有继续攻击。Legge 保留止攻与吉的并置，让克制出现在力量已经接近冲突的时候。",
        "发觉自己准备发送一条只为刺痛别人的话时，可以暂停，改写成事实与请求。真正存在的侵害仍需处理，克制不等于放弃保护自己。"
      ],
      "sourceRefs": [
        "zhouyi-13",
        "legge1882-13"
      ],
      "classicalTranslation": null
    },
    {
      "position": 5,
      "label": "九五",
      "polarity": "yang",
      "classical": "同人，先號啕而後笑。大師克相遇。",
      "focus": "相遇的转折不能脱离其代价",
      "paragraphs": [
        "文字由号啕转向笑，又写大军克服阻碍而相遇。它并不是一条没有冲突的温柔故事；Legge 也按受阻后实现联合解读。",
        "现代类比可以是双方终于弄清误会，重新找到可行目标。不能因此认为所有冲突最后都会团圆，更不应把古代战争比喻转成强迫他人合作的理由。"
      ],
      "sourceRefs": [
        "zhouyi-13",
        "legge1882-13"
      ],
      "classicalTranslation": null
    },
    {
      "position": 6,
      "label": "上九",
      "polarity": "yang",
      "classical": "同人于郊，無悔。",
      "focus": "有限的联系也可以成立",
      "paragraphs": [
        "联合到达郊外，《象传》仍说志未得。Legge 指出此时范围尚非普遍，但不必因此有悔。",
        "有些合作只能在一个具体项目上成立，不需要发展成无所不谈的关系。承认它的范围，反而容易保持清楚和互相尊重。"
      ],
      "sourceRefs": [
        "zhouyi-13",
        "legge1882-13"
      ],
      "classicalTranslation": null
    }
  ],
  "specialStatement": null,
  "modernExample": {
    "title": "让社区地图不只反映熟人的视角",
    "label": "原创现代情境",
    "paragraphs": [
      "几位老朋友想做一张街区公共空间地图，最初列出的地点都是他们常去的地方。有人提出邀请新居民和行动方式不同的邻居补充意见，并说明地图想帮助什么人解决什么问题。",
      "讨论时，不同意见出现了：有人重视热闹，有人需要安静。组织者没有要求大家统一喜好，而是把不同需求清楚标注，并说明哪些资料已经核实。",
      "地图未必满足所有人，但参与的范围与实际用途都更明白。同人的现代学习价值，在于让共同目标可以容纳差异，而非制造一个永远一致的小圈子。"
    ]
  },
  "misreadings": [
    "同人不保证人人相合；防备、止攻与有限联合都在六爻中。不能只截取团结的意思。",
    "卦象不能判断谁是敌人、谁会背叛，也不能为排斥某类人或强迫他人加入提供依据。"
  ],
  "practice": [
    "用一句话说明共同目标，并检查一个新参加的人能否理解。",
    "找出一个目前缺少发声机会、却会受结果影响的角色。",
    "区分必须一致的事项与可以保留差异的事项。"
  ],
  "related": [
    {
      "id": "hexagram-08",
      "name": "比",
      "paragraph": "比着重亲近和信任的基础，同人更适合继续问联合的范围与公共目标。关系亲近和共同承担一件事可以相助，却不是同一件事。"
    }
  ],
  "closing": "读同人卦时，不妨问：我所说的我们，是否给真正相关的人留下了位置？",
  "sourceIds": [
    "zhouyi-13",
    "legge1882-13",
    "hon-sep",
    "unicode-hexagrams",
    "legge-scan-rights"
  ],
  "createdAt": "2026-10-07",
  "reviewStatus": {
    "content": "complete_editorial_draft",
    "lineStructure": "validated",
    "editorialReview": "passed_independent_model_editorial_review",
    "nativeExpertReview": "not_performed",
    "published": false,
    "citations": "source_checked_with_access_limitations_recorded"
  },
  "textualNote": "九四采用中文底本明确列出的“墉”异文；该页正文另作“庸”。本篇保留该卦所据版本中的“無”字形。",
  "counts": {
    "chineseCharacterCount": 1569,
    "nonWhitespaceCharacterCount": 1788,
    "countBasis": "reader-facing article prose and quotations, excluding source list, metadata, line diagram and Markdown syntax"
  },
  "learningQuestion": null,
  "displayName": "同人",
  "sourceLocale": "zh",
  "sourceContentHash": "115cb4a182918042ff048e4e068018564f593189a73747887f9e378219369628",
  "translationStatus": "source_original",
  "articleMarkdown": "# 同人卦学习：共同目标怎样走出小圈子\n\n一句话：想和别人一起做成一件事，先把共同目标说清，也给不同背景的人留下参与的位置。\n\n几个人都说赞成一个想法，并不一定已经成为合作者。同人卦从门、宗族、郊野等不同范围写到联结，也写到防备与争夺。它让人思考：所谓我们，究竟包括谁，又因为什么在一起？文章中的现代应用讨论公开合作，古文的战争场景仍按历史意象说明。\n\n## 先认清这是什么卦\n\n同人是传统文王序第13卦，卦符䷌，下卦离☲、上卦乾☰，传统取象分别为火与天。爻从最下方数起，依次为初九、六二、九三、九四、九五、上九。实线为阳，断线为阴；九、六是爻题中标识阳、阴的数字，并不是额外的爻数。\n\n卦符：䷌　上卦：乾☰　下卦：离☲\n\n六爻位置自下而上编号；下面的图按实际位置从上往下显示：\n\n```text\n━━━━━━━━━  上九\n━━━━━━━━━  九五\n━━━━━━━━━  九四\n━━━━━━━━━  九三\n━━━━ ━━━━  六二\n━━━━━━━━━  初九\n```\n\n## 卦辞说了什么\n\n经文：“同人于野，亨。利涉大川，利君子貞。”\n\nLegge 把同人读作人与人的联合，强调“于野”的较开阔范围，并认为这种联结应超出私人偏好。利涉大川保留共同面对大困难的意象，利贞则给联结加上合宜的条件。\n\n初学时可以先问：我们共享的究竟是一个具体目标，还是彼此熟悉的感觉？共同目标不能抹去差异，也不因人多就自动正确。需要让参与者知道这件事为什么值得投入。\n\n## 《易传》怎样解读这个卦\n\n《彖传》《象传》属于《易传》，是通常所说的“十翼”中的篇章。下面把传文与卦辞、爻辞分开，再说明现代学习应用。\n\n《彖传》谈通天下之志；《象传》以天与火取象，又说“类族辨物”。这让共同性与分辨并列出现，同人并非要求所有事物毫无区别。\n\n现代合作可以既说明一致目标，也辨认不同的能力、观点与责任。若把不同意见都当作不团结，反而难以发现真正的问题。\n\n## 六爻逐条读\n\n以下引文属于爻辞；后面的解释为原创学习说明。吉、无咎、有悔等是古代占辞的语言，不能直接换成对个人未来的保证。\n\n### 初九：先跨出自己的门\n\n经文：“同人于門，無咎。”\n\n门口是接触外界的起点。Legge 将其读为联合开始发生，还没有被狭窄私心混入。\n\n发起共同活动时，先用别人能听懂的语言说明想做什么。不要假定新参加的人已经知道你和老朋友之间的默契。\n\n### 六二：熟悉的关系也可能缩小视野\n\n经文：“同人于宗，吝。”\n\n宗把联结放进宗族范围。Legge 借此讨论联合偏于亲近之人的局限，并未把亲情本身说成错误。\n\n如果重要决定只在几个熟人私聊中完成，可以检查其余参与者是否有机会了解和回应。亲近可以存在，但不能替代公共事务的说明。\n\n### 九三：防备与竞争可能阻住相遇\n\n经文：“伏戎于莽，升其高陵，三歲不興。”\n\n伏兵草莽、登高窥望而久不行动，是明显的军事画面。Legge 在爻间争取联合的关系中解释这种相持。\n\n普通合作里，可以检查是否把精力都用在猜测别人，而不愿直接澄清需要。三岁不是现实冲突的倒计时，这段也不提供隐蔽对抗的做法。\n\n### 九四：停止对抗可以改变方向\n\n经文：“乘其墉，弗克攻，吉。”\n\n爬上城墙，却没有继续攻击。Legge 保留止攻与吉的并置，让克制出现在力量已经接近冲突的时候。\n\n发觉自己准备发送一条只为刺痛别人的话时，可以暂停，改写成事实与请求。真正存在的侵害仍需处理，克制不等于放弃保护自己。\n\n### 九五：相遇的转折不能脱离其代价\n\n经文：“同人，先號啕而後笑。大師克相遇。”\n\n文字由号啕转向笑，又写大军克服阻碍而相遇。它并不是一条没有冲突的温柔故事；Legge 也按受阻后实现联合解读。\n\n现代类比可以是双方终于弄清误会，重新找到可行目标。不能因此认为所有冲突最后都会团圆，更不应把古代战争比喻转成强迫他人合作的理由。\n\n### 上九：有限的联系也可以成立\n\n经文：“同人于郊，無悔。”\n\n联合到达郊外，《象传》仍说志未得。Legge 指出此时范围尚非普遍，但不必因此有悔。\n\n有些合作只能在一个具体项目上成立，不需要发展成无所不谈的关系。承认它的范围，反而容易保持清楚和互相尊重。\n\n## 让社区地图不只反映熟人的视角\n\n以下是为学习而设的现代情境。\n\n几位老朋友想做一张街区公共空间地图，最初列出的地点都是他们常去的地方。有人提出邀请新居民和行动方式不同的邻居补充意见，并说明地图想帮助什么人解决什么问题。\n\n讨论时，不同意见出现了：有人重视热闹，有人需要安静。组织者没有要求大家统一喜好，而是把不同需求清楚标注，并说明哪些资料已经核实。\n\n地图未必满足所有人，但参与的范围与实际用途都更明白。同人的现代学习价值，在于让共同目标可以容纳差异，而非制造一个永远一致的小圈子。\n\n## 几个容易误读的地方\n\n同人不保证人人相合；防备、止攻与有限联合都在六爻中。不能只截取团结的意思。\n\n卦象不能判断谁是敌人、谁会背叛，也不能为排斥某类人或强迫他人加入提供依据。\n\n## 做一个小练习\n\n1. 用一句话说明共同目标，并检查一个新参加的人能否理解。\n2. 找出一个目前缺少发声机会、却会受结果影响的角色。\n3. 区分必须一致的事项与可以保留差异的事项。\n\n## 和比卦一起读\n\n比着重亲近和信任的基础，同人更适合继续问联合的范围与公共目标。关系亲近和共同承担一件事可以相助，却不是同一件事。\n\n读同人卦时，不妨问：我所说的我们，是否给真正相关的人留下了位置？\n\n## 阅读依据\n\n- [周易·同人](https://zh.wikisource.org/w/index.php?title=周易/同人&oldid=10645635)。Received Chinese text; Wikisource revision 10645635。\n- [The Yî King](https://tianmu.org/good-work-library/confucian/general-texts/the-i-ching-james-legge)。James Legge；Hexagram 13, chapter XIII, judgement, six lines and notes。\n- [Chinese Philosophy of Change (Yijing)](https://plato.stanford.edu/entries/chinese-change/)。Tze-Ki Hon；Modern scholarly context。\n- [Yijing Hexagram Symbols](https://www.unicode.org/charts/PDF/U4DC0.pdf)。Unicode Consortium；U+4DC0–U+4DFF。\n- [Sacred Books of the East volume16 scan metadata](https://commons.wikimedia.org/wiki/File:Sacred_Books_of_the_East_-_Volume_16.djvu)。Edition and rights metadata。\n\n经文引文保留繁体字并加现代标点；正文为简体中文原创学习解读。英文历史底本与中文传世文本对照使用，近现代译者的意见在文中注明。本文不构成医学、投资或其他专业决定的依据。\n\n文字说明：九四采用中文底本明确列出的“墉”异文；该页正文另作“庸”。本篇保留该卦所据版本中的“無”字形。\n"
}
